{
 "title": "Prime number theorem",
 "next": "Pick a lemma and follow what it rests on back to the axioms.",
 "plan": {
  "intent": "소수 정리의 짧은 증명은 어떤 명제들이 어떤 순서로 서로에 기대어 성립하는가",
  "views": [
   {"name": "Lemma dependency graph", "level": "root"},
   {"name": "Role of the analytic theorem", "level": "tauber"},
   {"name": "Definitions of Φ, θ, π", "level": "objects"},
   {"name": "Statements on ζ, Φ, θ (I–IV)", "level": "inputs"},
   {
    "name": "Proof roadmap",
    "why": "증명에는 시간 순서가 없고 기댐의 순서만 있습니다. 그 순서는 뿌리 레벨의 의존 그래프 자체이고, 주장마다의 길은 Scenario가 정리에서 바닥까지 걸어 보입니다."
   }
  ],
  "shallow": ["cheb", "zcont", "pnt", "asym"],
  "prove": "rules",
  "why": {
   "shallow": "(II), (III), (VI), 소수 정리의 증명은 몇 줄짜리 초등적 논증이라, 열지 않고 노드의 식으로 보입니다.",
   "prove": "Alloy가 볼 수 있는 것은 해석 정리의 명제 골격뿐이고, 내용은 복소해석에 있습니다. 그래서 골격이 정하는 규칙만 묻습니다: 규칙이 골격에서 틀리면 그림이 거짓말을 합니다. Scenario와 실패 경로는 증명에 시간이 없으므로 묻지 않습니다."
  }
 },
 "scenarios": [
  {
   "slug": "derive-pnt",
   "text": "π(x) ~ x/log x가 왜 성립하는지 보려면, 정리에서 출발해 θ(x) ~ x로, 다시 수렴하는 적분 (V)로 거슬러 내려갑니다.",
   "walk": [
    {
     "place": "pnt",
     "does": "소수 정리 π(x) ~ x/log x를 확인할 주장으로 세웁니다.",
     "expects": "주장은 x가 커질 때 π(x)·log x / x가 1로 간다는 것이고, 아직 아무것에도 기대지 않은 채 놓여 있습니다."
    },
    [
     [
      {
       "place": "objects",
       "does": "한 갈래는 정의로 내려갑니다. 소수 정리는 π와 θ를 맞세우는 일로 바뀝니다.",
       "expects": "π(x)와 θ(x)가 같은 소수들을 세되, θ는 소수마다 log p의 무게를 준다는 점이 드러납니다."
      },
      {
       "place": ["pi", "theta"],
       "does": "θ(x) ≤ π(x) log x와, ε > 0마다 θ(x) ≥ (1−ε) log x · (π(x) − x^(1−ε))를 씁니다.",
       "expects": "두 부등식을 x로 나누고 ε → 0으로 보내면, π(x) ~ x/log x는 θ(x) ~ x와 같은 말이 됩니다."
      }
     ],
     []
    ],
    {
     "place": "asym",
     "does": "두 갈래가 만나는 주장 θ(x) ~ x (VI)에 이릅니다. 쓰는 것은 θ가 줄지 않는다는 성질과 (V)뿐입니다.",
     "expects": "θ(x) ≥ λx (λ > 1)가 끝없이 큰 x에서 되풀이되면 ∫_x^{λx} (θ(t)−t)/t² dt ≥ ∫_1^λ (λ−t)/t² dt > 0이 되어, 적분이 수렴할 수 없습니다. λ < 1도 같습니다."
    },
    {
     "place": "integral",
     "does": "θ(x) ~ x가 기대는 마지막 주장, ∫_1^∞ (θ(x)−x)/x² dx의 수렴 (V)에 이릅니다.",
     "expects": "소수 정리는 이제 이 적분 하나가 수렴한다는 주장으로 줄어 있습니다."
    }
   ],
   "refs": [
    "[Zagier 1997, Newman's Short Proof of the Prime Number Theorem](https://people.mpim-bonn.mpg.de/zagier/files/doi/10.2307/2975232/fulltext.pdf)"
   ]
  },
  {
   "slug": "converge-the-integral",
   "text": "∫_1^∞ (θ(x)−x)/x² dx가 왜 수렴하는지 보려면, (V)에서 출발해 해석 정리의 두 가정이 어디서 채워지는지 갈래별로 따라갑니다.",
   "walk": [
    {
     "place": "integral",
     "does": "주장 (V): ∫_1^∞ (θ(x)−x)/x² dx가 수렴합니다. x = e^t로 바꾸면 ∫_0^∞ f(t) dt, f(t) = θ(e^t)e^(−t) − 1입니다.",
     "expects": "주장이 해석 정리의 결론 꼴, 곧 유계 함수의 적분이 수렴한다는 꼴로 바뀌어 있습니다."
    },
    [
     {
      "place": ["phi", "theta"],
      "does": "정의에서 Φ(s) = s∫_0^∞ e^(−st) θ(e^t) dt (Re s > 1)를 얻습니다.",
      "expects": "f의 라플라스 변환이 g(z) = Φ(z+1)/(z+1) − 1/z로, Φ만으로 적힙니다."
     },
     [
      {
       "place": "inputs",
       "does": "수론 쪽 사실의 묶음을 엽니다. 해석 정리의 첫째 가정은 여기서 채워집니다.",
       "expects": "묶음 안에는 θ에 대한 한계 (III)과 ζ, Φ에 대한 명제들이 있습니다."
      },
      {
       "place": "cheb",
       "does": "f가 유계라는 가정은 θ(x) = O(x) (III)에서 옵니다.",
       "expects": "|f(t)| = |θ(e^t)/e^t − 1|이 어떤 상수 B 아래에 있고, 이 한계는 소수에 대한 초등적 사실 하나로 채워집니다."
      }
     ],
     {
      "place": "phipole",
      "does": "g가 Re z ≥ 0까지 정칙이라는 가정은 Φ(s) − 1/(s−1)이 Re s ≥ 1에서 정칙이라는 (IV)에서 옵니다.",
      "expects": "g(z) = Φ(z+1)/(z+1) − 1/z의 z = 0 극은 상쇄되고, 허축 위 다른 점에서도 g는 정칙입니다."
     },
     [
      {
       "place": "tauber",
       "does": "두 가정이 모이는 곳, 해석 정리를 엽니다.",
       "expects": "해석 정리는 유계성과 허축까지의 정칙성만 요구합니다."
      },
      {
       "place": ["laplace", "function"],
       "does": "g를 f의 라플라스 변환으로, f를 유계 함수로 놓습니다.",
       "expects": "앞의 세 갈래가 f와 g에 꼭 맞는 가정을 건네, 정리를 그대로 적용할 수 있습니다."
      }
     ]
    ],
    {
     "place": "integral",
     "does": "네 갈래를 합쳐 해석 정리를 적용합니다.",
     "expects": "∫_0^∞ f(t) dt가 존재하고 g(0)과 같으므로, ∫_1^∞ (θ(x)−x)/x² dx가 수렴합니다."
    }
   ],
   "refs": [
    "[Zagier 1997, Newman's Short Proof of the Prime Number Theorem](https://people.mpim-bonn.mpg.de/zagier/files/doi/10.2307/2975232/fulltext.pdf)"
   ]
  },
  {
   "slug": "place-the-pole",
   "text": "Φ(s) − 1/(s−1)이 왜 Re s ≥ 1에서 정칙인지 (IV) 보려면, 그 주장에서 출발해 ζ의 영점 배제와 Φ의 연장으로 갈라졌다가 오일러 곱 (I)에서 다시 만납니다.",
   "walk": [
    {
     "place": "phipole",
     "does": "(IV)의 둘째 마디, Φ(s) − 1/(s−1)이 Re s ≥ 1에서 정칙이라는 주장에 섭니다.",
     "expects": "Re s ≥ 1에서 Φ가 극을 가질 수 있는 곳이 어디인지, 그리고 그 자리에 정말 극이 있는지를 따로 보이면 됩니다."
    },
    [
     {
      "place": "nonvanish",
      "does": "한 갈래는 ζ(s) ≠ 0 (Re s ≥ 1)에 기댑니다.",
      "expects": "직선 Re s = 1 위에 ζ의 영점이 없으므로, 그 위에서 Φ가 극을 가질 수 있는 자리는 s = 1 하나뿐입니다."
     },
     {
      "place": "phicont",
      "does": "다른 갈래는 Φ를 Re s > 1/2까지 유리형으로 늘리는 식에 기댑니다.",
      "expects": "−ζ'(s)/ζ(s) = Φ(s) + Σ_p log p / (p^s (p^s − 1))이고, 마지막 합이 Re s > 1/2에서 정칙이라 Φ의 극은 s = 1과 ζ의 영점에만 있습니다."
     }
    ],
    {
     "place": "euler",
     "does": "두 갈래가 오일러 곱 (I)에서 만납니다. 영점 배제의 Re s > 1 부분도, Φ와 −ζ'/ζ를 잇는 식도 여기서 나옵니다.",
     "expects": "s = 1의 극은 유수 1이라 1/(s−1)이 지우고 나머지 자리에는 극이 없으므로, Φ(s) − 1/(s−1)은 Re s ≥ 1에서 정칙입니다."
    },
    {
     "place": "riemann",
     "does": "(I)이 끝내 기대는 바닥은 ζ의 정의입니다.",
     "expects": "Re s > 1에서 ζ(s) = Σ n^(−s)라는 급수와 소인수분해의 유일성 말고 다른 가정은 쓰이지 않았습니다."
    }
   ],
   "refs": [
    "[Zagier 1997, Newman's Short Proof of the Prime Number Theorem](https://people.mpim-bonn.mpg.de/zagier/files/doi/10.2307/2975232/fulltext.pdf)"
   ]
  },
  {
   "slug": "rule-out-zeros",
   "text": "ζ(s)가 왜 Re s ≥ 1에서 0이 아닌지 보려면, Re s > 1은 오일러 곱으로, 직선 Re s = 1은 Φ의 연장과 (II)로 나누어 봅니다.",
   "walk": [
    {
     "place": "nonvanish",
     "does": "주장: Re s ≥ 1에서 ζ(s) ≠ 0입니다.",
     "expects": "Re s > 1과 Re s = 1을 서로 다른 근거로 보여야 합니다."
    },
    [
     {
      "place": "euler",
      "does": "Re s > 1에서는 오일러 곱 (I)이 수렴하는 곱이고, 곱하는 인자가 모두 0이 아닙니다.",
      "expects": "Re s > 1에서 ζ(s) ≠ 0이 바로 나옵니다."
     },
     [
      {
       "place": "phicont",
       "does": "직선 위의 1 + iα에서 ζ가 μ차 영점, 1 + 2iα에서 ν차 영점을 갖는다고 두고, Φ의 극을 셉니다.",
       "expects": "εΦ(1+ε) → 1, εΦ(1+ε±iα) → −μ, εΦ(1+ε±2iα) → −ν이고, Σ_r C(4, 2+r) Φ(1+ε+irα) ≥ 0에서 6 − 8μ − 2ν ≥ 0이므로 μ = 0입니다."
      },
      {
       "place": "zcont",
       "does": "그 셈은 ζ가 Re s > 0까지 유리형이고 s = 1에서만 단순극을 갖는다는 (II)에 기댑니다.",
       "expects": "그래서 εΦ(1+ε) → 1이고, 직선 위의 영점은 Φ의 단순극으로만 나타납니다."
      },
      {
       "place": "riemann",
       "does": "(II)는 ζ의 급수를 적분 ∫_1^∞ x^(−s) dx = 1/(s−1)과 비교한 것입니다.",
       "expects": "영점 배제 전체가 ζ의 정의와 (I), (II)만으로 섭니다."
      }
     ]
    ]
   ],
   "refs": [
    "[Zagier 1997, Newman's Short Proof of the Prime Number Theorem](https://people.mpim-bonn.mpg.de/zagier/files/doi/10.2307/2975232/fulltext.pdf)"
   ]
  },
  {
   "slug": "prove-analytic-theorem",
   "text": "해석 정리가 왜 성립하는지, 곧 g_T(0) → g(0)인지 보려면, 코시 공식 하나를 세우고 두 반원 위의 크기를 B/R로 누릅니다.",
   "walk": [
    {
     "place": ["laplace", "cauchy", "kernel"],
     "does": "g_T(z) = ∫_0^T f(t)e^(−zt) dt로 두고, 코시 공식에 뉴먼의 핵을 넣어 g(0) − g_T(0)을 경로 C 위의 적분으로 씁니다.",
     "expects": "g(0) − g_T(0) = (1/2πi) ∮_C (g(z) − g_T(z)) e^(zT) (1 + z²/R²) dz/z이고, C는 |z| = R, Re z ≥ −δ인 영역의 경계입니다."
    },
    {
     "place": ["semicircle", "function"],
     "does": "오른쪽 반원 C₊에서 f의 상한 B로 g − g_T를, 핵의 꼴로 나머지를 누릅니다.",
     "expects": "|g(z) − g_T(z)| ≤ B e^(−T Re z)/Re z이고 |e^(zT)(1 + z²/R²)/z| = e^(T Re z) · 2 Re z/R²이라, 피적분 함수가 2B/R² 아래에 있고 기여는 B/R 이하입니다."
    },
    {
     "place": ["laplace", "truncated"],
     "does": "왼쪽 C₋에서는 g와 g_T를 따로 봅니다. g_T는 정함수라 경로를 왼쪽 반원 |z| = R로 옮겨 같은 식으로 B/R로 누릅니다.",
     "expects": "g 쪽 적분은 C₋ 위에서 g가 고정되어 있고 e^(zT) → 0이므로 T → ∞에서 0으로 갑니다."
    },
    {
     "place": ["cauchy", "semicircle"],
     "does": "세 조각을 모읍니다.",
     "expects": "lim sup_{T→∞} |g(0) − g_T(0)| ≤ 2B/R이고 R은 마음대로 크게 잡을 수 있으므로, g_T(0) → g(0), 곧 ∫_0^∞ f(t) dt = g(0)입니다."
    }
   ],
   "refs": [
    "[Zagier 1997, Newman's Short Proof of the Prime Number Theorem](https://people.mpim-bonn.mpg.de/zagier/files/doi/10.2307/2975232/fulltext.pdf)"
   ]
  }
 ],
 "operations": [],
 "rules": [
  {
   "slug": "holomorphic-transform-integrates",
   "kind": "must",
   "formula": "all transform: LaplaceTransform | transform in HolomorphicOnAxis and transform.transforms in Bounded implies transform.transforms in Integrable",
   "text": "f가 유계이고 그 라플라스 변환 g가 Re z ≥ 0까지 정칙으로 늘어나면, ∫_0^∞ f(t) dt가 존재합니다(값은 g(0)). 증명 전체에서 수론이 아닌 해석의 힘은 모두 이 정리 하나에 들어 있습니다.",
   "refs": [
    "[Zagier 1997, Newman's Short Proof of the Prime Number Theorem](https://people.mpim-bonn.mpg.de/zagier/files/doi/10.2307/2975232/fulltext.pdf)"
   ]
  }
 ],
 "level": {
  "kind": "schema",
  "title": "Newman proof",
  "why": "증명의 명제들이 서로 어떻게 기대는지 보입니다. 선은 기대는 명제에서 기대어지는 것으로 가고, 왼쪽 위에서 오른쪽 아래로 읽으면 소수 정리가 수론 쪽 사실 (III), (IV)와 해석 정리 하나로 줄어드는 모습입니다.",
  "nodes": [
   {
    "id": "pnt",
    "label": "Prime number theorem",
    "x": 0,
    "y": 0,
    "what": "x 이하 소수의 개수 π(x)가 x/log x와 점근적으로 같다는 정리입니다. 증명의 마지막 줄이며, (VI)에서 몇 줄로 따라 나옵니다.",
    "refs": [
     "[Zagier 1997, Newman's Short Proof of the Prime Number Theorem](https://people.mpim-bonn.mpg.de/zagier/files/doi/10.2307/2975232/fulltext.pdf)"
    ],
    "media": [
     {
      "type": "code",
      "title": "From (VI)",
      "text": "θ(x) ≤ Σ_{p≤x} log x = π(x) log x\nθ(x) ≥ Σ_{x^(1−ε) < p ≤ x} (1−ε) log x\n     ≥ (1−ε) log x · (π(x) − x^(1−ε))"
     }
    ]
   },
   {
    "id": "asym",
    "label": "Theta asymptotic (VI)",
    "x": 1,
    "y": 1,
    "what": "θ(x) ~ x라는 주장입니다. 소수 정리와 같은 내용을 log p의 무게로 센 꼴이라, 해석적으로 다루기 쉽습니다.",
    "refs": [
     "[Zagier 1997, Newman's Short Proof of the Prime Number Theorem](https://people.mpim-bonn.mpg.de/zagier/files/doi/10.2307/2975232/fulltext.pdf)"
    ],
    "media": [
     {
      "type": "code",
      "title": "Contradiction for λ > 1",
      "text": "θ(x) ≥ λx 이면, θ가 줄지 않으므로\n∫_x^{λx} (θ(t) − t)/t² dt ≥ ∫_x^{λx} (λx − t)/t² dt = ∫_1^λ (λ − t)/t² dt > 0"
     }
    ]
   },
   {
    "id": "integral",
    "label": "Convergent integral (V)",
    "x": 2,
    "y": 1,